index,title,title_english,author,date,content,url,image_url,image_path
1,El péndulo de Trump mira a Kiev,Trump's pendulum looks to kyiv,,,El presidente estadounidense abandona ahora su preocupante equidistancia para presionar a Putin con sanciones económicas,https://elpais.com/opinion/editoriales/,,
2,Avances que no sean unilaterales,Advances that are not unilateral,,,Cualquier cambio legal que amplíe derechos como el permiso de fallecimiento debería ser fruto de un gran acuerdo entre los agentes sociales para su viabilidad y su futuro,https://elpais.com/opinion/editoriales/,,
3,"Cuantas menos cartas, más sobres","The fewer cards, the more envelopes",LOLA PONS RODRÍGUEZ,25 OCT 2025 - 05:30 CEST,"Apenas escribimos misivas en papel, y en España sus envoltorios ya son símbolos de corrupción",https://elpais.com/opinion/tribunas/,,
4,El que roba al ladrón,He who steals from the thief,ANTONIO MUÑOZ MOLINA,25 OCT 2025 - 05:30 CEST,Queremos que la pasión súbita no sea castigada y que los atracadores magistrales que usan el talento y no la violencia se salgan con la suya,https://elpais.com/autor/antonio-munoz-molina/,https://imagenes.elpais.com/resizer/v2/RT36YC6RURFXLP56CBRZR5CQ24.jpg?auth=aa3bc4618e6ebbc9fbd7aa05271d494bf09a6261a71184af2af80c4e5bde092c&width=414,D:\selenium_test-browserstack-main\selenium_elpais\output\images\article_4.jpg
5,‘Santuarios climáticos: toldos’,'Climate sanctuaries: awnings',,20 OCT 2025 - 05:45 CEST,"Con el aumento de las temperaturas y la falta de refugios climáticos accesibles, las clases trabajadoras recurren a soluciones sencillas y efectivas. En la costa mediterránea española, los toldos se multiplican en las fachadas de los grandes edificios frente al mar, convertidos en una defensa cotidiana frente al calor",https://elpais.com/opinion/,https://imagenes.elpais.com/resizer/v2/BO75GMC5ZVHUZN56S4GAFVJKLI.JPG?auth=811cbc3d297264430413a4fe26c79b60ccb54f7aed116a7e39927581a9abbc43&width=414&height=233&smart=true,D:\selenium_test-browserstack-main\selenium_elpais\output\images\article_5.jpg
